{
 "table": "aircraft-characteristics",
 "sources": [
  "CNA1979:34.6",
  "scan:p111",
  "scan:p112",
  "scan:p143",
  "scan:p144"
 ],
 "notes": [
  "Aircraft Characteristics Charts, printed as 4.44A (Commonwealth, jp2 111-112), 4.44b (Italian, jp2 143) and 4.44c (German, jp2 143-144, its continuation misheaded 4.44b); the rules call them 34.6. Read twice, from the archive.org scan and from the community chart PDFs (Commonwealth Charts.pdf pp. 1-2, Axis Charts.pdf pp. 1-2): 1224 cells compared, 1 differs, and only in convention (the Italian C 200 Saetta's range, printed ';40' with a stray mark, recorded as 40).",
  "Each nation has two sub-tables: fighters and fighter-bombers (table: fighter; mission columns F, S, R, D) and bombers, flying boats, transports and reconnaissance (table: bomber; D, R, B, Transport). Fighters need a pilot; the others do not.",
  "Columns: range in hexes (a '*' marks drop tanks; '**' a range for transfer missions only); tac_air, the air-to-air rating (in parentheses: the aircraft may never fly a mission on which it would start air-to-air combat); maneuver; bomb, bomb points ('n/Tm': n bomb points or m torpedo points; null: no bombs); fuel, fuel points per flight.",
  "Mission letters, as printed: F combat air patrol and strafing, S scramble, R reconnaissance, D strafing and any bombing, B Axis naval convoy and land support bombing, Transport what it carries (a number: TOE or replacement points; P: may drop paratroops; tons or fractions: supply). Marks: '!' capable by day; 'N' capable by day and night; '.' or null not capable; Commonwealth '0' night only in a restricted role (Blenheim IVF night scramble; Albacore night land-support or convoy bombing); 'S' strafing only (Lysander); 'A' may also strafe armour (Hurricane IID); '*' night scramble only (Bf.110, Ju.88C).",
  "alternative_of marks an 'or' row: the same aircraft in another configuration, chosen per mission.",
  "As printed and left so: Cant Z.501 tac_air '(2' (no closing parenthesis); Cant Z.506B range blank; Gladiator Mk. II fuel a dash; Beaufighter IF and VIF manufacturer blank; the B-17/D, B-26 and Bombay rows print an extra dot in the mission columns.",
  "Footnotes in our words: the Ar.196, Cant Z.501 and Z.506B and the Sunderland are flying boats; the Skua is a dive bomber; the Gladiator, Sea Gladiator, Swordfish and Valentia are biplanes; the C.714, D.520 and MS406 are French; the MS406, Sea Gladiator, Swordfish and Valentia never arrive as reinforcements."
 ],
 "rows": [
  {
   "id": "aircraft:cw:beaufighter-mk-if",
   "nation": "cw",
   "aircraft": "Beaufighter Mk. IF",
   "table": "fighter",
   "range": 117,
   "tac_air": 11,
   "maneuver": 30,
   "bomb": null,
   "fuel": 3,
   "missions": {
    "F": "N",
    "S": "!",
    "R": ".",
    "D": "."
   },
   "manufacturer": null,
   "sources": [
    "CNA1979:34.6",
    "scan:p111"
   ]
  },
  {
   "id": "aircraft:cw:beaufighter-mk-vif",
   "nation": "cw",
   "aircraft": "Beaufighter Mk. VIF",
   "table": "fighter",
   "range": 135,
   "tac_air": 12,
   "maneuver": 31,
   "bomb": null,
   "fuel": 3,
   "missions": {
    "F": "N",
    "S": "!",
    "R": ".",
    "D": "."
   },
   "manufacturer": null,
   "sources": [
    "CNA1979:34.6",
    "scan:p111"
   ]
  },
  {
   "id": "aircraft:cw:blenheim-mk-ivf",
   "nation": "cw",
   "aircraft": "Blenheim Mk. IVF",
   "table": "fighter",
   "range": 146,
   "tac_air": 5,
   "maneuver": 30,
   "bomb": null,
   "fuel": 3,
   "missions": {
    "F": "N",
    "S": "0",
    "R": ".",
    "D": "."
   },
   "manufacturer": "Bristol",
   "sources": [
    "CNA1979:34.6",
    "scan:p111"
   ]
  },
  {
   "id": "aircraft:cw:fulmar-mk-ii",
   "nation": "cw",
   "aircraft": "Fulmar Mk. II",
   "table": "fighter",
   "range": 74,
   "tac_air": 4,
   "maneuver": 29,
   "bomb": null,
   "fuel": 1,
   "missions": {
    "F": "N",
    "S": "!",
    "R": ".",
    "D": "."
   },
   "manufacturer": "Fairey",
   "sources": [
    "CNA1979:34.6",
    "scan:p111"
   ]
  },
  {
   "id": "aircraft:cw:gladiator-mk-ii",
   "nation": "cw",
   "aircraft": "Gladiator Mk. II",
   "table": "fighter",
   "range": 44,
   "tac_air": 2,
   "maneuver": 27,
   "bomb": null,
   "fuel": null,
   "missions": {
    "F": "!",
    "S": "!",
    "R": ".",
    "D": "."
   },
   "manufacturer": "Gloster",
   "sources": [
    "CNA1979:34.6",
    "scan:p111"
   ]
  },
  {
   "id": "aircraft:cw:hurricane-mk-i",
   "nation": "cw",
   "aircraft": "Hurricane Mk. I",
   "table": "fighter",
   "range": 52,
   "tac_air": 4,
   "maneuver": 32,
   "bomb": null,
   "fuel": 1,
   "missions": {
    "F": "!",
    "S": "!",
    "R": ".",
    "D": "."
   },
   "manufacturer": "Hawker",
   "sources": [
    "CNA1979:34.6",
    "scan:p111"
   ]
  },
  {
   "id": "aircraft:cw:hurricane-mk-iia",
   "nation": "cw",
   "aircraft": "Hurricane Mk. IIA",
   "table": "fighter",
   "range": "88*",
   "tac_air": 4,
   "maneuver": 25,
   "bomb": null,
   "fuel": 2,
   "missions": {
    "F": "!",
    "S": ".",
    "R": ".",
    "D": "."
   },
   "manufacturer": "Hawker",
   "sources": [
    "CNA1979:34.6",
    "scan:p111"
   ]
  },
  {
   "id": "aircraft:cw:hurricane-mk-iia-or1",
   "nation": "cw",
   "aircraft": "Hurricane Mk. IIA",
   "table": "fighter",
   "alternative_of": "aircraft:cw:hurricane-mk-iia",
   "range": 44,
   "tac_air": 4,
   "maneuver": 36,
   "bomb": null,
   "fuel": 1,
   "missions": {
    "F": "!",
    "S": "!",
    "R": ".",
    "D": "."
   },
   "manufacturer": null,
   "sources": [
    "CNA1979:34.6",
    "scan:p111"
   ]
  },
  {
   "id": "aircraft:cw:hurricane-mk-iia-or2",
   "nation": "cw",
   "aircraft": "Hurricane Mk. IIA",
   "table": "fighter",
   "alternative_of": "aircraft:cw:hurricane-mk-iia",
   "range": 39,
   "tac_air": 4,
   "maneuver": 33,
   "bomb": 2,
   "fuel": 1,
   "missions": {
    "F": "!",
    "S": ".",
    "R": ".",
    "D": "!"
   },
   "manufacturer": null,
   "sources": [
    "CNA1979:34.6",
    "scan:p111"
   ]
  },
  {
   "id": "aircraft:cw:hurricane-mk-iib",
   "nation": "cw",
   "aircraft": "Hurricane Mk. IIB",
   "table": "fighter",
   "range": "88*",
   "tac_air": 6,
   "maneuver": 25,
   "bomb": null,
   "fuel": 2,
   "missions": {
    "F": "!",
    "S": ".",
    "R": ".",
    "D": "."
   },
   "manufacturer": "Hawker",
   "sources": [
    "CNA1979:34.6",
    "scan:p111"
   ]
  },
  {
   "id": "aircraft:cw:hurricane-mk-iib-or1",
   "nation": "cw",
   "aircraft": "Hurricane Mk. IIB",
   "table": "fighter",
   "alternative_of": "aircraft:cw:hurricane-mk-iib",
   "range": 44,
   "tac_air": 6,
   "maneuver": 36,
   "bomb": null,
   "fuel": 1,
   "missions": {
    "F": "!",
    "S": "!",
    "R": ".",
    "D": "."
   },
   "manufacturer": null,
   "sources": [
    "CNA1979:34.6",
    "scan:p111"
   ]
  },
  {
   "id": "aircraft:cw:hurricane-mk-iib-or2",
   "nation": "cw",
   "aircraft": "Hurricane Mk. IIB",
   "table": "fighter",
   "alternative_of": "aircraft:cw:hurricane-mk-iib",
   "range": 39,
   "tac_air": 6,
   "maneuver": 32,
   "bomb": 4,
   "fuel": 1,
   "missions": {
    "F": "!",
    "S": ".",
    "R": ".",
    "D": "!"
   },
   "manufacturer": null,
   "sources": [
    "CNA1979:34.6",
    "scan:p111"
   ]
  },
  {
   "id": "aircraft:cw:hurricane-mk-iic",
   "nation": "cw",
   "aircraft": "Hurricane Mk. IIC",
   "table": "fighter",
   "range": "86*",
   "tac_air": 8,
   "maneuver": 25,
   "bomb": null,
   "fuel": 2,
   "missions": {
    "F": "!",
    "S": ".",
    "R": ".",
    "D": "."
   },
   "manufacturer": "Hawker",
   "sources": [
    "CNA1979:34.6",
    "scan:p111"
   ]
  },
  {
   "id": "aircraft:cw:hurricane-mk-iic-or1",
   "nation": "cw",
   "aircraft": "Hurricane Mk. IIC",
   "table": "fighter",
   "alternative_of": "aircraft:cw:hurricane-mk-iic",
   "range": 43,
   "tac_air": 8,
   "maneuver": 36,
   "bomb": null,
   "fuel": 1,
   "missions": {
    "F": "!",
    "S": "!",
    "R": ".",
    "D": "."
   },
   "manufacturer": null,
   "sources": [
    "CNA1979:34.6",
    "scan:p111"
   ]
  },
  {
   "id": "aircraft:cw:hurricane-mk-iic-or2",
   "nation": "cw",
   "aircraft": "Hurricane Mk. IIC",
   "table": "fighter",
   "alternative_of": "aircraft:cw:hurricane-mk-iic",
   "range": 38,
   "tac_air": 8,
   "maneuver": 30,
   "bomb": 6,
   "fuel": 1,
   "missions": {
    "F": "!",
    "S": ".",
    "R": ".",
    "D": "!"
   },
   "manufacturer": null,
   "sources": [
    "CNA1979:34.6",
    "scan:p111"
   ]
  },
  {
   "id": "aircraft:cw:hurricane-mk-iid",
   "nation": "cw",
   "aircraft": "Hurricane Mk. IID",
   "table": "fighter",
   "range": "90*",
   "tac_air": 8,
   "maneuver": 25,
   "bomb": null,
   "fuel": 2,
   "missions": {
    "F": "!",
    "S": ".",
    "R": ".",
    "D": "."
   },
   "manufacturer": "Hawker",
   "sources": [
    "CNA1979:34.6",
    "scan:p111"
   ]
  },
  {
   "id": "aircraft:cw:hurricane-mk-iid-or1",
   "nation": "cw",
   "aircraft": "Hurricane Mk. IID",
   "table": "fighter",
   "alternative_of": "aircraft:cw:hurricane-mk-iid",
   "range": 45,
   "tac_air": 8,
   "maneuver": 33,
   "bomb": null,
   "fuel": 1,
   "missions": {
    "F": "A",
    "S": "!",
    "R": ".",
    "D": "."
   },
   "manufacturer": null,
   "sources": [
    "CNA1979:34.6",
    "scan:p111"
   ]
  },
  {
   "id": "aircraft:cw:p-40-kittyhawk-i",
   "nation": "cw",
   "aircraft": "P-40 Kittyhawk I",
   "table": "fighter",
   "range": "94*",
   "tac_air": 4,
   "maneuver": 31,
   "bomb": null,
   "fuel": 2,
   "missions": {
    "F": "!",
    "S": ".",
    "R": ".",
    "D": "."
   },
   "manufacturer": "Curtis",
   "sources": [
    "CNA1979:34.6",
    "scan:p111"
   ]
  },
  {
   "id": "aircraft:cw:p-40-kittyhawk-i-or1",
   "nation": "cw",
   "aircraft": "P-40 Kittyhawk I",
   "table": "fighter",
   "alternative_of": "aircraft:cw:p-40-kittyhawk-i",
   "range": 71,
   "tac_air": 4,
   "maneuver": 33,
   "bomb": null,
   "fuel": 1,
   "missions": {
    "F": "!",
    "S": "!",
    "R": ".",
    "D": "."
   },
   "manufacturer": null,